paper_id,title,year,authors,journal,publication_type,doi,abstract,keyword_1,keyword_2,keyword_3,keyword_4,keyword_5,countries_mentioned,geographic_level,activity_type,emission_type,method,analysis_type,hotspots,data_sources,relevance,notes,sector_tag
84,Metal pollution assessment of surface water in the emission field of the slovinky tailing impoundment (Slovakia),2021,"Fazekašová, D., Fazekaš, J., & Štofejová, L.",Water,Articolo su rivista,https://doi.org/10.3390/w13213143,"The focus of this work is on the evaluation of selected water quality indicators as per the applicable regulations, taking into account European and national legislation and the evaluation of the risk of contamination of surface waters with toxic elements using the contamination factor (𝐶𝑖𝑓
) and the degree of pollution (𝐶𝑑
). The studied area of Slovinky is an important ore region, with rich deposits of copper and silver ores that have been mined for centuries. One of the most important remnants of mining activities in this area is the Slovinky tailing impoundment. The sludge pond area has an area of 15 ha, and the height of the dam is 113 m above sea level, which makes the sludge pond one of the tallest water structures in Slovakia. The Slovinský creek was monitored in the years 2010, 2011, and 2019 at five sampling points, which were selected to map the entire length of the water flow from the source to the estuary to the river Hornád. Risk elements (As, Cu, Cd, and Fe) and physicochemical parameters (such as temperature, dissolved oxygen concentration, conductivity, resistivity, salinity, total dissolved solids, NaCl, redox potential, and pH) were included in this study and evaluated according to applicable regulations, taking into account European legislation (Act No. 269/2010 Coll., guideline value WHO 2011). The results of the experimental studies showed that the highest values of As and Cu were measured at the site where drainage waters from the Slovinky tailing impoundment and mining water of the Alžbeta shaft flow into the creek. The concentration of As exceeded the limit value by up to 31 times and the concentration of Cu 16.8–134.5 times. At the same time, the highest values of conductivity, salinity, total dissolved solids, and NaCl were found, and there was no acidification of water at the site that had the highest pollution. Water contamination was assessed based on 𝐶𝑖𝑓
 and 𝐶𝑑
; our findings showed that the surface water from the site of contamination, along the entire length of the stream, was very highly contaminated with risk elements in the order of As > Fe > Cu, and the level of contamination decreased with distance from the site of contamination. Our research shows that seepage of toxic substances from sludge ponds and abandoned mines has caused the requirements for the quality of surface water of the Slovinský creek not to be met. In connection with mining activities, surface streams act as a transport medium through which other components of the environment can be polluted.",Mining activity,risk elements,degree of contamination,contamination factor,physicochemical parameters,Slovakia,NUTS 2,Contaminazione delle acque,"Water pollution (As, Cu, Cd e Fe)","Laboratory Analysis, Pollution Indices, and Statistical Analyses",Ambientale,Spiš region (Slovakia),"Water samples collected  in 2010, 2011, and 2019",Media,,MINING_EU
85,Human Health Effects of Heavy Metal Pollution in the Cross-Border Area of Romania and Serbia: A Review,2021,"Adriana Isvoran, Diana Larisa Roman, Daniela Dascalu, Beatrice Vlad-Oros, Alecu Ciorsac, Laura Pitulice, Radojka Jonovic, Zoran Stevanovic, and Vasile Ostafe",Ecological Chemistry and Engineering S,Review,https://doi.org/10.2478/eces-2021-0025,"This review illustrates the state of air, water and soil pollution with heavy metals resulting from mining activities in the cross-border area of Romania and the Republic of Serbia. It also emphasizes the possible human health effects that certain heavy metals can cause. The heavy metals that were identified as polluting the air, water, and/or soil in the area of interest are: As, Cd, Cr, Cu, Fe, Hg, Mn, Mo, Ni, Pb, and Zn. Acute or chronic exposure to these heavy metals may cause numerous human health effects as they affect numerous organs and tissues (gastrointestinal tract, liver, lungs, kidneys, bladder, central nervous system, reproductive system, etc.). The review shows that the pollution produced by both abandoned and active mines cannot be neglected and underlines the necessity of changes in the current mining practices so that mining operations will assure better protection for the environment and human health.",Mining activity,pollution,heavy metals,human health effects,,Romania,NUTS 2,"state of air, water and soil pollution with heavy metals resulting from mining activities","Air, water and soil pollution (As, Cd, Cr, Cu, Fe, Hg, Mn, Mo, Ni, Pb, and Zn)",,,,,,,MINING_EU
86,Simulation Possibilites of the Post-Mining Goafs Impact on the Deformations Induced by Next Underground Mining Operations with Use of the Cellular Automata Method,2021,"Paweł, S.",Geotecnical and Geological Engineering,Articolo su rivista,https://doi.org/10.1007/s10706-020-01595-w,"Underground mining operations in the area of a rock mass affected by previous exploitation may cause additional deformations to appear on the surface. The size of these deformations can be significant, and their character is often non-linear. The nature of these deformations cannot be justified solely by the impact of current mining operations. At the same time, the predictive method of S. Knothe, widely used in Poland, does not explicitly include these types of phenomena. In the area of intensive and long-term mining exploitation, such as the Upper Silesian Coal Basin, the practical possibility of simulating this occurrence may be helpful in the planning of new mining exploitation under construction objects. Today we are usually limited to numerical modelling methods like finite difference method (FDM). This one base on the principle of mechanical similarity. The theoretical usefulness of method (and its similar) has already been proven many times. The main impediment to its practical application is the lack of recognition of the rock mass in terms of its mechanical properties. The presented method is a new approach to the possibility of modelling the subject phenomenon. The method has not been used in practical forecasting mining area deformation caused by underground deposits mining. It’s characterized by a huge potential for further development.",Subsidence,underground mining,Cellular automata,Finite difference method,Post-mining goaf,Poland,NUTS 2,Underground mining operations,"Subsidence, surface deformations","Cellular Automata Method, Finite difference method (FDM)",Ambientale,Upper Silesian Coal Basin -USCB (Poland),Rock samples,Media,,MINING_EU
87,"Peat bogs as archives of local ore mining and smelting activities over the centuries: A case study of Miasteczko Śląskie (Upper Silesia, Poland)",2021,"Tadeusz Magiera, Maria Magdalena Szuszkiewicz, Adam Michczyński, Leszek Chróst, Marcin Szuszkiewicz",Catena,Articolo su rivista,https://doi.org/10.1016/j.catena.2020.105063,"One of the oldest areas of ore mining in Upper Silesia (southern Poland) is Miasteczko Śląskie, which is surrounded by numerous peat bogs developed in the Brynica Valley. These can offer a good alternative to standard archaeological investigations because they are valuable archives of climatic and anthropogenic impacts. The main aim of this study was to detect traces of human activity and historical mining and smelting in the Brynica River catchment using a combination of magnetic, radiometric and geochemical methods. The research was conducted on two peat profiles: Moczydła and Żyglinek. The application of mass-specific magnetic susceptibility (χ), the determination of the content of heavy metals (Pb, Cu, Zn, Cd, Fe) and radiocarbon dating allowed for investigation into the distribution of anthropogenic pollutants in the peat profile. Additionally, the enrichment factor (EF) of selected heavy metals was calculated. The results revealed the potential mobility of Cu, Zn and Cd in peat profiles and the lack of Pb mobility. Maximum enrichment of Pb could be observed in the Moczydła profile at a depth of 17 cm (5,996 mg kg−1) and in the Żyglinek profile at a depth of 14 cm, where it amounted to 287 mg kg−1 and dated back to the period 1300–1600 AD. However, in the Żyglinek profile a noticeable increase in the value of χ could be seen from a depth of 40 cm, where peat layers corresponded to 2700 BC. The high correlation observed between anthropogenic Pb (EFPb) and magnetic parameters (χ and χ/Fe) will be useful for the further study of the tracers of ore mining and smelting and other historical human impacts on the environment. It can support archaeological studies conducted at the sites of early settlements, which in Central and Northern Europe were very often located on hills surrounded by swamps and peat bogs.",Mining activity,Peatland,heavy metals,,,Poland,NUTS 2,Peat bogs in mining areas,"Heavy metals (Pb, Cu, Zn, Cd, Fe) and radiocarbon","Combination of magnetic, radiometric and geochemical methods",Ambientale,"Miasteczko Śląskie, Upper Silesian Coal Basin -USCB (Poland)",Peat profiles samples,Alta,,MINING_EU
88,"Morphology, Mineralogy, and Chemistry of Atmospheric Aerosols Nearby an Active Mining Area: Aljustrel Mine (SW Portugal)",2021,"Barroso, A., Mogo, S., Silva, M. M. V. G., Cachorro, V., & de Frutos, Á.",Atmosphere,Articolo su rivista,https://doi.org/10.3390/atmos12030333,"Mining activities increase contaminant levels in the environment, so it is crucial to study the particulate matter in these areas to understand the impacts on nearby urban areas and populations. This work was conducted close to the active mine of Aljustrel (Portugal), where black dust deposition is evident. PM10 samples were collected in two periods: 10–17 July and 1–10 November of 2018. Two different techniques were used: SEM-EDX for the individual characterization of the aerosols and ICP-MS to quantify the elemental concentration of 11 elements (Ca, Na, Fe, Mn, As, Cd, Cu, Sb, Pb, and Zn). In this region, the observed PM10 mass concentration was 20 to 47 µg m −3 (July) and 4 to 23 µg m−3 (November), which is lower than the limit of 50 μg m−3 established in the European Directive. The individual characterization of 2006 particles by SEM-EDX shows oxides (17%) and sulfides (10%), while Na, Si, Fe, S, Al, and Cu are the elements with the most representativeness in all the analyzed particles. The ICP-MS results indicate that the daily elemental concentration in the samples collected in July is higher than November, and only As exceeds the limit established for European legislation.",Mining exploitation,atmospheric aerosols,SEM-EDX,ICP-MS,,Portugal,NUTS 2,Impatto dell'attività mineraria sulle aree urbane e le popolazioni limitrofe,"Heavy metals (Ca, Na, Fe, Mn, As, Cd, Cu, Sb, Pb e Zn)",SEM-EDX and ICP-MS,Ambientale,Aljustrel (Portugal),PM10 samples were collected in two periods: 10–17 July and 1–10 November of 2018,Alta,,MINING_EU
89,Mining and Europe’s world heritage cultural landscapes,2021,"Tost, M., Ammerer, G., Kot-Niewiadomska, A., & Gugerell, K.",Resources,Articolo su rivista,https://doi.org/10.3390/resources10020018,"This study examines the four cases of World Heritage protected cultural landscapes in Europe that are characterized by mining in order to identify the role mining plays today in such cultural landscapes, the legal requirements for their protection, and also the exploration and exploitation in these areas and the differences that exist between the five European countries concerned. Using a qualitative comparative case study approach, the authors find that active mining is taking place in the Austrian case, and exploration is happening adjacent to the German/Czech protected cultural landscape. The legal protection of the cases is mainly based on heritage and monument protection legislation as well as environment protection legislation including the Natura 2000 network. Differences exist, as other than in Germany, exploration and mining could be allowed in protected areas, which is also contrary to the position of the United Nations Educational, Scientific, and Cultural Organization, and the International Council on Mining and Metals.",Cultural landscapes,mining,mineral resources,World Heritage Sites,Sustainable land use,"Austria, Germany, Czech Republic, Poland","NUTS 2, nazionale",Esplorazione e attività mineraria in aree protette,,"In-depth document and policy analysis, deuctive content analysis, mapping of institutional regulations and mechanisms",Ambientale,"Hallstatt-Dachstein—Salzkammergut Cultural Landscape (Austria); Nord-Pas de Calais Mining Basin (France); Erzgebirge/Krušnohoří Mining Region (Germany, Czechia); Krzemionki Prehistoric Striped Flint Mining Region (Poland)",4 cases characterized by mining are examined: (i) Hallstatt-Dachstein–Salzkammergut (Austria); (ii) Nord-Pas de Calais Mining Basin; (iii) Montanregion Erzgebirge/Krušnohoří (Germany/Czech Republic); and (iv) Krzemionki Prehistoric Striped Flint Mining Region (Poland),Media/Alta,,MINING_EU
90,"Pedological characterization of soils in Gutai Mountains near a mining area, Romania",2021,"Voşgan, Z., Dippong, T., Hoaghia, MA. et al.",Environmental Earth Science,Articolo su rivista,https://doi.org/10.1007/s12665-021-09473-1,"Metal pollution is considered a major issue in terms of human and animal health, as well as ecological risks, due to the bioaccumulation, biomagnification, persistence and high toxicity of metals. Worldwide, even nowadays the anthropogenic activities have negative consequences on the natural environments starting from the deep of the oceans upon the highest peaks. In Romania, mining activities and different industries influence the quality of the environmental factors. The soil matrix, due to its slow regeneration capacity is a very vulnerable system. The aim of this study is to assess the quality of soil collected from the vicinity of Gutai Mountains, nearby one of the most problematic mining exploitation area in the country. Samples were collected from different altitudes at different horizons and were analysed for the metal content (Cd, Cu, Ni, Mn, Pb and Zn), pH, humus, total nitrogen content, colour, texture, particle size, structure. The results indicate high amount of Pb, which exceeded the threshold, showing contamination at 1150 m altitude, and a low amount for Cd, Cu, Ni, Mn and Zn. Based on the cluster analysis, similarities are observed among Cd, Cu and Pb, as well as between humus and the total nitrogen. Pollution and risk indices are used to assess the contamination degree, the probability of toxicity and the potential ecological risk. Results indicate that almost 50% of the studied soil samples show contamination with Pb, although there is a low potential ecological risk and 21% probability of toxicity.",soil,metals,pollution indices,risk indices,Gutai Mountains,Romania,NUTS 2,Impatto ambientale dell'attività mineraria,"Heavy metals ((Cd, Cu, Ni, Mn, Pb e Zn)","Granulometric analysis, Hygroscopic coefficient, pH measurement, Humus content, Metal content, Kjeldhal method",Ambientale,Gutai Mountains (Romania),7 soil samples collected,Alta,,MINING_EU
91,"Changes detected in the extent of surface mining and reclamation using multitemporal Landsat imagery: a case study of Jiu Valley, Romania",2021,"Vorovencii, I.",Environmental Monitoring Assessment,Articolo su rivista,https://doi.org/10.1007/s10661-020-08834-w,"Surface mining represents the dominant driver of land coverage changes in the Jiu Valley mining area in Romania. Detecting and quantifying active mines and reclaimed areas are very important tasks given the effects of surface mining on the environment. In this paper, Landsat imagery for the years 1988, 1998, 2008, and 2017 was used to map the extent of surface mining and reclamation in the Jiu Valley mining area. The satellite images were classified using the Support Vector Machine (SVM) algorithm to map land cover classes, including mined areas, and post-classification comparison (PCC) technique to track changes through time. In order to identify and quantify active mines and reclaimed areas of mined areas, we used indices such as Normalized Difference Vegetation Index (NDVI), Soil-Adjusted Vegetation Index (SAVI), and Modified Soil-Adjusted Vegetation Index-2 (MSAVI-2). For the entire area studied, during the period 1988–2017, the extent of surface mining was 6.5%, with peaks in the periods 1988–1998 and 1998–2008, namely, 205.2% and 4.0%, respectively, as a result of the extension of surface exploitation as distinct from that underground. Land cover conversion to mined areas was almost exclusively from agricultural, forest, and pasture. The results show that NDVI estimated the largest surfaces with active mines, reclaimed grassland, and reclaimed woodland, within the mined areas. SAVI and MSAVI-2 estimated larger surfaces classified as reclaimed forest. As a result of the expansion of surface mining areas, the landscape was considerably degraded through mining scars, landscape fragmentation, degradation, and pollution. However, during the past few years, reclamation activity has intensified in the affected areas through the occurrence of spontaneous vegetation, but also through forestation.",Spectral mixture analysis,Spectral mixture analysis,vegetation index,Active mine,Satellite image,Romania,NUTS 2,Land coverage changes in active mines,Landscape degradation,"Support Vector Machine (SVM), post-classification comparison (PCC) technique, Normalized Difference Vegetation Index (NDVI), Soil-Adjusted Vegetation Index (SAVI), and Modified Soil-Adjusted Vegetation Index-2 (MSAVI-2)",Ambientale,Oltenia mining basin (Romania),"Landsat imagery for the years 1988, 1998, 2008, and 2017",Alta,,MINING_EU
92,Gold mining stakeholders: Diversity and influence. Roșia Montană case study,2021,"Adela Deaconu, Crina Ioana Filip",Journal of East European Management Studies,Articolo su rivista,https://doi.org/10.5771/0949-6181-2021-1-117,"Using historiography, online information and the stakeholders’ theory, this study focuses on the interested parties involved in a highly controversial gold mining project in Romania’s Roșia Montană area. The study documents the emergence and influence of different stakeholders (and the relationships between them). The research result suggests that company management and project investors (in this case involving the State as minority owner and regulator and a Canadian company as the majority owner) need to be aware of the objectives of a range of stakeholders including the general public, environmental campaigners and cultural agencies. They should identify shared stakeholder objectives and take these objectives into account when assessing the prospects of a mining project. Ultimately, these findings could be a lesson in political conduct for stakeholders involved in similar projects in other East European countries.",gold mining history,stakeholders,environment,cultural heritage,Romania,Romania,NUTS 2,interested parties involved in a highly controversial gold mining project,"Land use, ghg emissions, cultural heritage damage","stakeholder’s theory, qualitative research method based on narra‐
tive inquiry, resorting to documentary research and historiography","Ambientale, economica, sociale",Roșia Montană area (Romania),"online information, writings on RM gold mine history and on its
present challenges (opinion essays, documentary books)",Alta,Utile per l'analisi degli stakeholder,MINING_EU
93,Determination of heavy metals in the territory of contaminated areas of Greece and their restoration through hyperaccumulators,2021,"Charvalas, G., Solomou, A.D., Giannoulis, K.D. et al.",Environmental Science and Pollution Research,Review,https://doi.org/10.1007/s11356-020-11920-8,"Phytoremediation is an effective technique for the processing of contaminated soil and for sequestering environmental contaminants such as heavy metals. This kind of pollution is ubiquitous in mines and similar excavation sites. This mini-review aims to provide an overview of the alternative forms of restoring contaminated soils (phytoremediation) highlighting the areas of Kozani (Agios Dimitrios) and Chalkidiki (Stratoni) in Greece characterized by exorbitant metallurgical activities. Firstly, a literature search in databases such as ScienceDirect, SciFinder, PubMed, Google Scholar, and Scopus was conducted, using the following keywords to identify relevant articles: “utilization”, “plants”, “phytoremediation”, “sustainability”, “environment”, and “restoration”. Two case studies have subsequently been chosen in Northern Greece, one characterized by metal mining (Pb, Zn, Ag) and hot summer Mediterranean climate and another one involving lignite mining and concomitant Cr, Zn, Cu, and Ni pollution under subtropical climate. Based on the literature search some possible, non-invasive plant species were proposed, focusing on the most efficient hyperaccumulators.",soil pollution,heavy metals,soil contamination,Phytoremediation,mining,Greece,NUTS 2,Soil contamination in mining areas,"Heavy metals (Cr, Zn, Cu, and Ni)",Literature search and case studies analysis,Ambientale,"Kozani - Agios Dimitrios, Chalkidiki Stratoni (Greece)","Research on ScienceDirect, SciFinder, PubMed, Google Scholar, and Scopus was conducted, using these keywords to identify relevant articles: “utilization”, “plants”, “phytoremediation”, “sustainability”, “environment”, and “restoration”",Alta,,MINING_EU
94,"Concentration of trace elements in raptors from three regions of slovakia, central europe",2021,"Hurníková, Z., Šalamún, P., Miklisová, D., ... Komorová, P., Chovancová, G.",Polish Journal of Environmental Studies,Articolo su rivista,https://doi.org/10.15244/pjoes/137329,"Slovakia situated in the territory of Central Europe has a rich mining and industrial history with a strong pollutive impact on the environment, with heavy metals and metalloids as the most often analysed pollutants. Despite a relatively advanced toxic elements research, none enquiry has been performed in birds of prey, the most suitable bioindicators, in Slovakia yet. Regarding the lack of information, the presented study represents the first integrated results of the contamination status of raptor species with selected trace elements (arsenic, cadmium, chromium, copper, mercury, manganese and lead). In all, livers and muscles of 80 individuals across twelve species were collected and analysed using atomic absorption spectroscopy. Within the study, copper was the element detected with the highest concentrations, in several individuals overlapping the toxic threshold. Additionally, the results disclosed high hepatic lead concentrations, pointed to the probability of acute poisoning through lead shot ingestions, in three birds of prey. Subsequent comparative analyses revealed significantly higher concentrations of mercury in surveyed Spiš and Tatry region when compared with the other two sampling regions. Also, the highest average and median values concerning liver concentrations of cadmium and manganese and muscle concentrations of chromium were measured in samples originated from this region. The whole territory of the Spiš and Tatry region is covered by national parks and protected areas, and several European Important Bird Areas occurred there. Together with rich mining and smelting history and also the existence of natural geochemical anomalies, toxic elements biomonitoring should be continued in this area.
Finally, it can be concluded that the first oriented research in Slovakia showed that the concentration of monitored metals in the liver and muscles of birds of prey did not exceed the established tolerable levels, except for copper, cadmium, and lead, for which concentrations exceeding defined toxic thresholds were occasionally found and cases of intoxication them with were reported.",heavy metals,trace elements,raptors,pollution,biondicators,Slovakia,NUTS 2,Contamination status of raptor species with selected trace elements,"Heavy metals (arsenic, cadmium, chromium, copper, mercury, manganese and lead)",Analisi in laboratorio,Ambientale,"Abov and Gemer with
districts Košice and Rožňava, Dolný Zemplín including districts Trebišov,
Michalovce, and Sobrance, Spiš and Tatry with districts Spišská
Nová Ves, Stará Ľubovňa, Kežmarok, Poprad and
Liptovský Mikuláš (Slovakia)","80 individuals across twelve species
of birds of prey were collected",Alta,,MINING_EU
