paper_id,title,year,authors,journal,publication_type,doi,abstract,keyword_1,keyword_2,keyword_3,keyword_4,keyword_5,countries_mentioned,geographic_level,activity_type,emission_type,method,analysis_type,hotspots,data_sources,relevance,notes,sector_tag
290,How to manage uncertainty in future Life Cycle Assessment (LCA) scenarios addressing the effect of climate change in crop production,2015,"Monia Niero, 
Cathrine Heinz Ingvordsen, 
Rikke Bagger Jørgensen, 
Michael Zwicky Hauschild",Journal of Cleaner Production,scientific journal,10.1016/j.jclepro.2015.05.061,"When Life Cycle Assessment (LCA) is used to provide insights on how to pursue future food demand, it faces the challenge to describe scenarios of the future in which the environmental impacts occur. In the case of future crop production, the effects of climate change should be considered. In this context, the objectives of this paper are two-fold: (i) to recommend an approach to deal with uncertainty in scenario analysis for LCA of crop production in a changed climate, when the goal of the study is to suggest strategies for adaptation of crop cultivation practices towards low environmental impacts, and (ii) to implement the suggested approach to spring barley cultivation in Denmark. First, the main implications of climate change for future crop cultivation are analyzed, and the factors which should be included when modeling the climate change effects on crops through LCA are introduced, namely climate, soil, water loss and production parameters. Secondly, the handling of these factors in the inventory modeling is discussed and finally implemented in the case study. Our approach follows a 3-step procedure consisting of: (1) definition of a baseline scenario at the Life Cycle Inventory (LCI) level for the selected crop and performance of Life Cycle Impact Assessment (LCIA) including normalization and contribution analysis, in order to identify the focus points in terms of impact categories, unit processes and substances; (2) identification of the main deviations from the baseline scenario for these key parameters in alternative future scenarios; (3) comparison of the different scenarios including quantification of the uncertainty at inventory level.
The procedure presented was successfully implemented to assess the consequences of the changed climate on Danish spring barley cultivated under future climate conditions. The LCA results, obtained using mainly primary data from phytotron experiments mimicking a future Danish climate, emphasized that adaptation strategies should prioritize the development of resilient and stable cultivars, i.e. robust to the expected extremes of the future climate and offering a reasonable yield under different climatic conditions.
",LCIPrimary dataScenario analysisHotspot analysisNormalization,Primary data,Scenario analysis,Hotspot analysis,Normalization,,,,,,,,,,,AGRI_EU
291,Using tree crop pruning residues for energy purposes: A spatial analysis and an evaluation of the economic and environmental sustainability,2016,"Biancamaria Torquati a, Daniela Marino a, Sonia Venanzi a, PierRiccardo Porceddu b, Massimo Chiorri",Biomass and Bioenergy,scientific journal,10.1016/j.biombioe.2016.09.017,"The use of biomass for energy production is one of the promising alternatives identified by the European Union to reduce greenhouse gas emissions and to ensure energy supply security. The aim of this research is to analyse the potential energy production from pruning residues of vineyards and olive groves in four municipalities of the Umbria Region, along with its economic and environmental sustainability. Geo-spatial, economic and environmental analyses were carried out. The integrated approach was used to estimate the total quantity of biomass produced in that area and to identify a logistic network for its transportation. Assuming a power plant whose size and technical properties were based on the analysis results, chain costs and potential profit margins were also calculated and resulting CO2 emissions estimated. The results show that the fragmentation and dispersion of agricultural activities, as well as technical and logistical decisions noticeably affect the economic and environmental sustainability of the proposed agro-energetic chain, in terms of both energy balance and CO2 emissions.",Pruning,Greenhouse gas emissions,Geo-spatial analysis,Agroenergetic chain,,,,,,,,,,,,AGRI_EU
292,Convective transport of dissolved gases determines the fate of the greenhouse gases produced in reactive drainage filters,2017,"Jacob Bruun, 
Carl Christian Hoffmann, 
Charlotte Kjaergaard ",Ecological Engineering,scientific journal,10.1016/j.ecoleng.2016.10.027,"Mitigation of agricultural nitrogen (N) loss via tile drains using woodchip-based subsurface constructed wetlands seems promising. However, the stochastic nature of drainage discharge and consequent temporal variations in hydraulic loading rates may result in the emission of the greenhouse gases (GHG) nitrous oxide (N2O) and methane (CH4) with potentially severe climatic effects that are not yet adequately studied. We investigated the influence of the direction of the convective transport on the net export of GHGs by measuring the two export paths of the gases (emitted and dissolved via the effluent) in six woodchip-based subsurface constructed wetlands with different hydraulic designs (horizontal and vertical up- and downward flow). Emissions ranged from −75.1 to 49.5 μg N2Osingle bondN m−2 h−1 and from −0.28 to 720 mg CH4single bondC m−2 h−1. Dissolved concentrations in the effluent ranged from 0 to 1108 μg N2Osingle bondN L−1 and from 4 to 8452 μg CH4single bondC L−1. Nitrous oxide emissions were negligible; thus, the main export path for N2O was as gas dissolved in the effluent. April and December were temporal hotspots for N2O production. High CH4 emissions and high dissolved concentrations were associated with the low hydraulic loading and high temperature occurring during the Danish summer. We found no effect of hydraulic design on the net export of N2O, whereas the ratio between CH4 emissions and net export in the form of dissolved CH4 via the effluent (the export ratio) was significantly affected. In conclusion, vertical downward flow lowered the export ratio of CH4 and may be the best hydraulic design, when conditions (i.e. low HLR) facilitate high CH4 production.",Methane,Nitrous oxide,Constructed wetlands,Woodchips,Reactive filters,,,,,,,,,,,AGRI_EU
293,Environmental sustainability issues in the food-energy-water nexus: Breakfast cereals and snacks,2015,"Harish Kumar Jeswani, 
Richard Burkinshaw, 
Adisa Azapagic ",Sustainable production and consumption,scientific journal,10.1016/j.spc.2015.08.001,"Understanding environmental impacts of complete food supply chains is important for the food industry to help devise strategies for reducing the impacts of current and future products. Breakfast cereals are one of the most important foods consumed in many countries, but their environmental impacts are currently unknown. Therefore, this study explores the environmental sustainability issues in the food–energy–water nexus by considering breakfast cereals manufactured by one of the world’s largest producers, Kellogg Europe. A life cycle assessment has been carried out for these purposes with the aim of helping the Company to integrate environmental sustainability considerations into the design of their products and packaging. The results indicate that the average global warming potential (GWP) of Kellogg’s breakfast cereals is 2.64 kg CO
 eq. per kg of product. The main GWP hotspots are the ingredients (48%) and energy used in the manufacturing process (23%); packaging and transport contribute 15% each. Rice is the single largest contributor to the GWP of the ingredients (38%). The manufacturing stage is the main contributor of primary energy demand (34%), while the ingredients are responsible for more than 90% of the water footprint. The ingredients are also the main contributors to most other environmental impacts, including land use (97%), depletion of elements (61%), eutrophication (71%), human toxicity (54%) and photochemical smog (50%). The impacts from packaging are high for freshwater and marine toxicity. The contribution of transport is significant for depletion of elements and fossil resources (23%), acidification (32%), ozone depletion (28%) and photochemical smog (24%). Improvement opportunities explored in the paper include better agricultural practices, recipe modifications, improved energy efficiency of manufacturing processes and use of alternative packaging. Impacts from consumption are also discussed.",Breakfast cereals,Global warming potential,Water footprint,Energy consumption,Life cycle assessment,,,,,,,,,,,AGRI_EU
294,Assessing the environmental burden of nickel sulfate for batteries: A life cycle perspective,2025,"F., Valencia, Frida; M., Rabbani, Mohsen; A., Fahimi, Ario; E., Vahidi, Ehsan","Resources, Conservation and Recycling",scientific journal,10.1016/j.resconrec.2025.108130,"The environmentally friendly and competitive mining practices for refining nickel sulfate hexahydrate are paramount to the energy transition. This research leverages a process-based life cycle assessment tool to investigate the carbon footprint of manufacturing battery-grade nickel sulfate hexahydrate from six pathways: hydrometallurgical (i) intermediate mixed sulfide precipitate in Brazil, (ii) mixed hydroxide precipitate in Australia, (iii) direct nickel process in Australia, pyrometallurgical (iv) nickel pig iron in Indonesia, (v) pure class 1 nickel metal in Canada, and (vi) the caron method for producing basic nickel carbonate in Cuba. The results indicate that the lowest carbon footprint was from the Canada-Norway mining and pyrometallurgical pathway, which produced 6.72 kg CO<inf>2eq</inf> per kg of nickel sulfate hexahydrate. Notably, the Direct Nickel process in Australia generated 5.01 kg CO<inf>2eq</inf>. per kg of the product without considering process electricity. Consequently, the study employs network analysis metrics from inventories’ CO<inf>2-eq</inf> emissions to highlight process materials vulnerabilities. Significant reductions in climate change, acidification, ecotoxicity, eutrophication, and ozone depletion are achievable by adopting renewable energy sources for processing and refining, aligning with low-carbon, responsible production, and clean energy development goals. Our hotspot analysis identifies energy consumption in Indonesia's Rotary Kiln-Electric-Furnace nickel pig iron and nickel sulfate production process as a critical factor, with electricity from coal significantly contributing to GWP. This study suggests that transitioning to 50 % hydropower energy could reduce GWP from 86.4 to 45 kg CO<inf>2eq</inf> per kg of nickel sulfate product, leading to decarbonization. © 2025 Elsevier B.V., All rights reserved.",Circular Economy; Ghg Emissions; Life Cycle Assessment; Network Analysis; Nickel Production; Nickel Sulfate; Ammonium Nitrate; Calcium Carbonate; Hydrogen Sulfide; Magnesium Oxide; Nickel Sulfate; Ozone; Direct Process Refining; Kyoto Protocol; Low Emission; Nickel Mines; Nickel Sulfates; Australia; Circular Economy; Environmental Burdens; Ghg Emission; Indonesia; Low Carbon; Nickel Pig Irons; Nickel Production; Nickel Sulfate Hexahydrate; Nickel Sulphate; Nickel Refining; Ammonium Nitrate; Calcium Carbonate; Hydrogen Sulfide; Lignite; Magnesium Oxide; Nickel Sulfate; Ozone; Emission; Energy Storage; Environmental Economics; Greenhouse Gas; Life Cycle Analysis; Network Analysis; Nickel; Acidification; Article; Brazil; Canada; Carbon Footprint; China; Climate Change; Crystallization; Ecotoxicity; Electricity; Environment; Environmental Burden; Environmental Impact; Eutrophication; Leaching; Life Cycle; Life Cycle Assessment; Liquefaction; Manufacturing; Norway; Ozone Depletion; Particulate Matter; Renewable Energy; Vulnerability; Cuba,,,,,Canada,National,,,,,,,,,MIN_OUT
295,Greenhouse gas emissions from cattle enclosures in semi-arid sub-Saharan Africa: The case of a rangeland in South-Central Kenya,2024,"S.M., Leitner, Sonja Maria; V., Carbonell, Victoria; R.L., Mhindu, Rangarirayi Lucia; Y., Zhu, Yuhao; P.M., Mutuo, Paul M.; K., Butterbach-Bahl, Klaus; L., Merbold, Lutz","Agriculture, Ecosystems and Environment",scientific journal,10.1016/j.agee.2024.108980,"Extensive livestock production in pastoral areas supports millions of livestock keepers in Sub-Saharan Africa (SSA). However, it is also linked to environmental externalities such as greenhouse gas (GHG) emissions. Corralling of livestock overnight in fenced enclosures (“bomas” in Kiswahili) is common to protect animals from theft and predation and is practiced across SSA. Boma manure is usually not removed and accumulates over years, making bomas GHG emission hotspots. The following study presents the first full year of CO<inf>2</inf>, CH<inf>4</inf>, and N<inf>2</inf>O emissions measurements from cattle bomas in a savanna ecosystem in Kenya, comparing active (in use) and inactive (i.e., abandoned) bomas. Active bomas were used for 1–3 months before being abandoned and cattle were moved to a new boma. GHG emissions were measured using static chambers inside three replicate bomas and along three 100 m transects from bomas into undisturbed savanna. Compared to savanna background fluxes, it was found that GHG flux rates from bomas were elevated by several orders of magnitude, with mean fluxes of 487 ± 8 mg CO<inf>2</inf>-C m−2 h−1, 325 ± 11 µg N<inf>2</inf>O-N m−2 h−1, and 3245 ± 234 µg CH<inf>4</inf>-C m−2 h−1 for active bomas, and 167 ± 52 mg CO<inf>2</inf>-C m−2 h−1, 610 ± 186 µg N<inf>2</inf>O-N m−2 h−1, and 3127 ± 1262 µg CH<inf>4</inf>-C m−2 h−1 for inactive bomas, while surrounding savanna soils only emitted 22.3 ± 18.2 mg CO<inf>2</inf>-C m−2 h−1, 2.5 ± 2.2 µg N<inf>2</inf>O-N m−2 h−1, and 0.1 ± 0.7 µg CH<inf>4</inf>-C m−2 h−1. Assuming that bomas are used for 45 days per year, annual manure emission factors were 2.43 ± 0.42%N for N<inf>2</inf>O and 0.49 ± 0.07%C for CH<inf>4</inf>, which corresponds to 2.64 ± 0.37 g CH<inf>4</inf> kg−1 volatile solids (VS). These emission factors were similar to IPCC default values for feedlots for low-producing cattle in warm climates; however, the IPCC only considers emissions in year when bomas are in use and does not account for emissions following boma abandonment. At the farm scale, boma manure contributed little (2.2%) to total CH<inf>4</inf> emissions, which were dominated by enteric CH<inf>4</inf> emissions (97.6%); but bomas were a substantial source for N<inf>2</inf>O, contributing over 32% to total N<inf>2</inf>O emissions on the farm. This calls for the inclusion of active and inactive bomas in the activity data collection for national GHG inventories, as bomas are currently overlooked hotspots for GHG emissions that are not represented in the GHG budgets of African nations. To mitigate GHG emissions, manure should be removed regularly and used as fertilizer to return nutrients to the grassland, preventing nutrient mining and ensuring long-term rangeland productivity and resilience, or it might be used to grow crops and livestock feeds. © 2024 Elsevier B.V., All rights reserved.",Boma; Manure; Methane; Nitrous Oxide; Cattle; Greenhouse Gas; Livestock Farming; Manure; Methane; Nitrous Oxide; Predation; Rangeland; Semiarid Region; Kenya,,,,,Kenya,National ,,,,,,,,,MIN_OUT
296,Methane emissions from abandoned coal and oil and gas developments in New Brunswick and Nova Scotia,2019,"J.P., Williams, James P.; D.A., Risk, David A.; A., Marshall, Alexander; N.R., Nickerson, Nick R.; A., Martell, Alexandra; C., Creelman, Chance; M., Grace, Mitch; G.D., Wach, Grant D.",Environmental Monitoring and Assessment,scientific journal,10.1007/s10661-019-7602-1,"Energy reserves have been exploited in the Atlantic Canadian provinces since the early 1600s, and many fossil fuel extraction sites have been abandoned over this long history of energy development. Oil, natural gas, and coal extraction sites are a source of greenhouse gas emissions, particularly for methane (CH<inf>4</inf>). In this study, we used multiple sampling methods to measure CH<inf>4</inf> from abandoned coal mine openings in Nova Scotia and a legacy oilfield in New Brunswick. Atmospheric and shallow soil gases were sampled around legacy sites using flux rate chamber measurements (spatial and temporal) and plot-scale atmospheric gas surveys, in addition to regional gas screening surveys over larger populations of sites to confirm whether small-scale observations were reflected regionally. Only one oil and gas site (2.4 ± 3.1⋅ 102 mg m− 2 day− 1) and one abandoned coal mine opening (1.0 ± 1.1⋅ 102 mg m− 2 day− 1) were affected by soil CH<inf>4</inf> migration, though rates of leakage were minimal and would rank as low severity on industrial scales. Plot-scale atmospheric gas screening showed super-ambient CH<inf>4</inf> concentrations at 5 sites in total (n = 16), 2 coal adits and 3 abandoned oil and gas wells. Regional gas screening surveys suggest that 11% of legacy oil and gas sites have some emission impacts, compared with 1–2% of legacy coal sites. These frequencies are close, albeit lower than the 15% of legacy oil and gas sites and 10% of abandoned coal mine openings flagged from our aggregated small-scale observations. These sites may emit less than other developments studied to date either because more time has elapsed since extraction, or because differences in regional geology reduce the likelihood of sustained emissions. This study provides valuable information to help understand the methane emission risks associated with legacy energy sites. © 2019 Elsevier B.V., All rights reserved.",Abandoned Fossil Fuel Sites; Atmospheric Gas Sampling; Geochemical Analysis; Methane Emissions; Soil Gas Flux; Methane; Natural Gas; Coal; Greenhouse Gases; Methane; Natural Gas; Soil; Abandoned Mines; Abandoned Wells; Analytical Geochemistry; Coal; Coal Mines; Exploratory Geochemistry; Extraction; Gas Emissions; Gas Fuel Analysis; Greenhouse Gases; Methane; Mining; Soils; Surveys; Abandoned Fossil Fuel Sites; Gas Sampling; Geochemical Analysis; Methane Emissions; Soil Gas; Proven Reserves; Fossil Fuel; Methane; Coal; Natural Gas; Abandoned Land; Coal Mine; Concentration (composition); Emission; Geochemistry; Soil Gas; Article; Coal Mining; Controlled Study; Intermethod Comparison; New Brunswick; Nova Scotia; Oil And Gas Field; Spatial Analysis; Temporal Analysis; Analysis; Chemistry; Environmental Monitoring; Greenhouse Gas; Pollution; Soil; Canada; Environmental Monitoring; Environmental Pollution; Greenhouse Gases; Natural Gas; Oil And Gas Fields; Soil,,,,,Canada,National ,,,,,,,,,MIN_OUT
297,Derivation of greenhouse gas emission factors for peatlands managed for extraction in the Republic of Ireland and the United Kingdom,2015,"D.G., Wilson, David G.; S.D., Dixon, Simon D.; R.R., Artz, Rebekka R.E.; T.E.L., Smith, Thomas E.L.; C.D., Evans, Chris D.; H.J.F., Owen, H. J.F.; E., Archer, E.; F., Renou-Wilson, Florence",Biogeosciences,scientific journal,10.5194/bg-12-5291-2015,"Drained peatlands are significant hotspots of carbon dioxide (CO<inf>2</inf>) emissions and may also be more vulnerable to fire with its associated gaseous emissions. Under the United Nations Framework Convention on Climate Change (UNFCCC) and the Kyoto Protocol, greenhouse gas (GHG) emissions from peatlands managed for extraction are reported on an annual basis. However, the Tier 1 (default) emission factors (EFs) provided in the IPCC 2013 Wetlands Supplement for this land use category may not be representative in all cases and countries are encouraged to move to higher-tier reporting levels with reduced uncertainty levels based on country- or regional-specific data. In this study, we quantified (1) CO<inf>2</inf>-C emissions from nine peat extraction sites in the Republic of Ireland and the United Kingdom, which were initially disaggregated by land use type (industrial versus domestic peat extraction), and (2) a range of GHGs that are released to the atmosphere with the burning of peat. Drainage-related methane (CH<inf>4</inf>) and nitrous oxide (N<inf>2</inf>O) emissions as well as CO<inf>2</inf>-C emissions associated with the off-site decomposition of horticultural peat were not included here. Our results show that net CO<inf>2</inf>-C emissions were strongly controlled by soil temperature at the industrial sites (bare peat) and by soil temperature and leaf area index at the vegetated domestic sites. Our derived EFs of 1.70 (±0.47) and 1.64 (±0.44) t CO<inf>2</inf>-C ha-1 yr-1 for the industrial and domestic sites respectively are considerably lower than the Tier 1 EF (2.8 ± 1.7 t CO<inf>2</inf>-C ha-1 yr-1) provided in the Wetlands Supplement. We propose that the difference between our derived values and the Wetlands Supplement value is due to differences in peat quality and, consequently, decomposition rates. Emissions from burning of the peat (g kg-1 dry fuel burned) were estimated to be approximately 1346 CO<inf>2</inf>, 8.35 methane (CH<inf>4</inf>), 218 carbon monoxide (CO), 1.53 ethane (C<inf>2</inf>H<inf>6</inf>), 1.74 ethylene (C<inf>2</inf>H<inf>4</inf>), 0.60 methanol (CH<inf>3</inf>OH), 2.21 hydrogen cyanide (HCN) and 0.73 ammonia (NH<inf>3</inf>), and this emphasises the importance of understanding the full suite of trace gas emissions from biomass burning. Our results highlight the importance of generating reliable Tier 2 values for different regions and land use categories. Furthermore, given that the IPCC Tier 1 EF was only based on 20 sites (all from Canada and Fennoscandia), we suggest that data from another 9 sites significantly expand the global data set, as well as adding a new region. © 2018 Elsevier B.V., All rights reserved.",Biomass Burning; Carbon Dioxide; Carbon Emission; Carbon Monoxide; Emission Control; Greenhouse Gas; Horticulture; Kyoto Protocol; Leaf Area Index; Methane; Nitrous Oxide; Peatland; Soil Temperature; Ireland; United Kingdom,,,,,Canada,National ,,,,,,,,,MIN_OUT
298,A watershed fragility index for assessing the vulnerability of river ecosystems,2025,"K.C.S., Lira, K. C.S.; M.V.Z.D., Jong, M. Van Zyll De; M., King, M.; I.G., Cowx, Iain G.",Ecological Indicators,scientific journal,10.1016/j.ecolind.2025.113908,"Accelerating impacts of climate change have heightened the vulnerability of ecosystems, posing critical challenges to biodiversity conservation. While current climate change vulnerability assessment frameworks provide valuable insights, they often fall short of fully integrating local stressors. This paper introduces the Watershed Fragility Index (WFI), an innovative tool designed to address these gaps by offering a more comprehensive evaluation of multiple stressors. The WFI leverages Geographic Information Systems (GIS) for spatial analysis, Fuzzy logic for handling ecological complexity and variation, and the Analytic Hierarchy Process (AHP) for prioritizing stressors. For a better comprehension of various exposures, 12 factors are assessed − flooding susceptibility, temperature change, wildfire potential, soil type, geology, distance from waterbodies, slope, altitude, land use and cover, distance from roads, watercourse barriers, and forest change. They are organized into different sub-indexes related to natural disturbances, environmental fragility, and anthropogenic stressors. The tool is demonstrated on the Humber River watershed in the province of Newfoundland and Labrador, in eastern Canada. The results indicate that certain stressors create vulnerable areas near important lakes. Overall, the watershed is classified predominantly as low fragility. However, the most vulnerable regions, characterized by moderate fragility, are mainly found in the Lower Humber area, which also contains a larger area with roads, watercourse barriers, and steeper slopes. The outputs offer crucial insights to aid environmental planning within the Humber River watershed and can serve as an evaluation tool for other regions. The WFI is a novel tool for policy development, enabling environmental managers and conservationists to create targeted and adaptive strategies that enhance habitat and species resilience through comprehensive and integrated assessment. © 2025 Elsevier B.V., All rights reserved.",Analytic Hierarchy Process (ahp); Environmental Impact Assessment; Fuzzy Logic; Geographic Information Systems (gis); Watershed Fragility Index (wfi); Analytic Hierarchy Process; Climate Change; Ecosystems; Environmental Impact Assessments; Environmental Management; Forestry; Geographic Information Systems; Hierarchical Systems; Information Use; Rivers; Soil Conservation; Soils; Watersheds; Analytic Hierarchy; Fragility Index; Fuzzy-logic; Geographic Information; Geographic Information System; Hierarchy Process; Impact Assessments; River Watersheds; Watershed Fragility Index; Fuzzy Logic; Analytical Hierarchy Process; Climate Change; Environmental Impact Assessment; Freshwater Ecosystem; Gis; Lake Water; Vulnerability; Watershed; England; Humber River [england]; United Kingdom,,,,,Canada,National ,,,,,,,,,AGRI_OUT
